Title,Description,URL
6 Best AI Tools for Dropshipping Product Research in 2026,"Discover the top resources for best AI tools for dropshipping product research. Perfect for ecommerce beginners who want to save time and grow their Shopify store faster using AI. Find winning dropshipping products faster with these AI-powered research tools. Tested for beginners — no guesswork, no wasted ad spend.",https://example.com/6-best-ai-tools-for-dropshipping-product-research-in-2026
How AI is changing ecommerce for beginners | best AI tools for dropshipping product research,"If you're just starting out with best AI tools for dropshipping product research, this guide breaks everything down step by step — no tech skills required. Includes real tool recommendations and beginner tips.",https://example.com/6-best-ai-tools-for-dropshipping-product-research-in-2026
Save hours every week: best AI tools for dropshipping product research,AI tools are transforming ecommerce. Here's everything a beginner needs to know about best AI tools for dropshipping product research — from free options to paid upgrades that are worth the investment.,https://example.com/6-best-ai-tools-for-dropshipping-product-research-in-2026
Beginner's guide to best AI tools for dropshipping product research,Looking for the best approach to best AI tools for dropshipping product research? We tested the top options so you don't have to. Read the full breakdown on Smart AI Growth Hub.,https://example.com/6-best-ai-tools-for-dropshipping-product-research-in-2026
best AI tools for dropshipping product research — what actually works in 2026,Running an online store as a solo entrepreneur? Learn how best AI tools for dropshipping product research can save you hours every week and help you compete with bigger brands.,https://example.com/6-best-ai-tools-for-dropshipping-product-research-in-2026
Stop guessing: find the best best AI tools for dropshipping product research,"This guide covers everything you need to know about best AI tools for dropshipping product research — including what to avoid, what to prioritise, and how to get started on a budget.",https://example.com/6-best-ai-tools-for-dropshipping-product-research-in-2026
The only guide you need for best AI tools for dropshipping product research,"Ecommerce beginners: here's your shortcut to best AI tools for dropshipping product research. We cover the tools, the steps, and the tips that actually make a difference in 2026.",https://example.com/6-best-ai-tools-for-dropshipping-product-research-in-2026
Smart tools for smart ecommerce: best AI tools for dropshipping product research,"Want to work smarter, not harder? Best ai tools for dropshipping product research is one of the fastest ways to level up your Shopify store without hiring a team. See how inside.",https://example.com/6-best-ai-tools-for-dropshipping-product-research-in-2026
Ecommerce on autopilot — best AI tools for dropshipping product research,"From product research to customer support, AI is reshaping ecommerce for beginners. This post on best AI tools for dropshipping product research is your starting point. Save it for later!",https://example.com/6-best-ai-tools-for-dropshipping-product-research-in-2026
Start smarter: best AI tools for dropshipping product research,"Smart AI Growth Hub breaks down best AI tools for dropshipping product research for ecommerce beginners — with honest reviews, real pricing, and actionable next steps. No fluff.",https://example.com/6-best-ai-tools-for-dropshipping-product-research-in-2026
