Title,Description,URL
How to Automate Your Shopify Store with AI (Step-by-Step for Beginners),Discover the top resources for automate Shopify with AI. Perfect for ecommerce beginners who want to save time and grow their Shopify store faster using AI. Learn how to automate your Shopify store with AI step by step. Cut hours of manual work and grow your ecommerce business faster — beginner-friendly guide.,https://example.com/how-to-automate-your-shopify-store-with-ai-step-by-step-for-beginners
How AI is changing ecommerce for beginners | automate Shopify with AI,"If you're just starting out with automate Shopify with AI, this guide breaks everything down step by step — no tech skills required. Includes real tool recommendations and beginner tips.",https://example.com/how-to-automate-your-shopify-store-with-ai-step-by-step-for-beginners
Save hours every week: automate Shopify with AI,AI tools are transforming ecommerce. Here's everything a beginner needs to know about automate Shopify with AI — from free options to paid upgrades that are worth the investment.,https://example.com/how-to-automate-your-shopify-store-with-ai-step-by-step-for-beginners
Beginner's guide to automate Shopify with AI,Looking for the best approach to automate Shopify with AI? We tested the top options so you don't have to. Read the full breakdown on Smart AI Growth Hub.,https://example.com/how-to-automate-your-shopify-store-with-ai-step-by-step-for-beginners
automate Shopify with AI — what actually works in 2026,Running an online store as a solo entrepreneur? Learn how automate Shopify with AI can save you hours every week and help you compete with bigger brands.,https://example.com/how-to-automate-your-shopify-store-with-ai-step-by-step-for-beginners
Stop guessing: find the best automate Shopify with AI,"This guide covers everything you need to know about automate Shopify with AI — including what to avoid, what to prioritise, and how to get started on a budget.",https://example.com/how-to-automate-your-shopify-store-with-ai-step-by-step-for-beginners
The only guide you need for automate Shopify with AI,"Ecommerce beginners: here's your shortcut to automate Shopify with AI. We cover the tools, the steps, and the tips that actually make a difference in 2026.",https://example.com/how-to-automate-your-shopify-store-with-ai-step-by-step-for-beginners
Smart tools for smart ecommerce: automate Shopify with AI,"Want to work smarter, not harder? Automate shopify with ai is one of the fastest ways to level up your Shopify store without hiring a team. See how inside.",https://example.com/how-to-automate-your-shopify-store-with-ai-step-by-step-for-beginners
Ecommerce on autopilot — automate Shopify with AI,"From product research to customer support, AI is reshaping ecommerce for beginners. This post on automate Shopify with AI is your starting point. Save it for later!",https://example.com/how-to-automate-your-shopify-store-with-ai-step-by-step-for-beginners
Start smarter: automate Shopify with AI,"Smart AI Growth Hub breaks down automate Shopify with AI for ecommerce beginners — with honest reviews, real pricing, and actionable next steps. No fluff.",https://example.com/how-to-automate-your-shopify-store-with-ai-step-by-step-for-beginners
