Title,Description,URL
How to Start a Shopify Store Using AI (Beginner's Guide for 2026),Discover the top resources for start a Shopify store using AI. Perfect for ecommerce beginners who want to save time and grow their Shopify store faster using AI. Learn how to start a Shopify store using AI in 2026. This beginner's guide covers every step — from picking a niche to launching with AI-powered tools.,https://example.com/how-to-start-a-shopify-store-using-ai-beginners-guide-for-2026
How AI is changing ecommerce for beginners | start a Shopify store using AI,"If you're just starting out with start a Shopify store using AI, this guide breaks everything down step by step — no tech skills required. Includes real tool recommendations and beginner tips.",https://example.com/how-to-start-a-shopify-store-using-ai-beginners-guide-for-2026
Save hours every week: start a Shopify store using AI,AI tools are transforming ecommerce. Here's everything a beginner needs to know about start a Shopify store using AI — from free options to paid upgrades that are worth the investment.,https://example.com/how-to-start-a-shopify-store-using-ai-beginners-guide-for-2026
Beginner's guide to start a Shopify store using AI,Looking for the best approach to start a Shopify store using AI? We tested the top options so you don't have to. Read the full breakdown on Smart AI Growth Hub.,https://example.com/how-to-start-a-shopify-store-using-ai-beginners-guide-for-2026
start a Shopify store using AI — what actually works in 2026,Running an online store as a solo entrepreneur? Learn how start a Shopify store using AI can save you hours every week and help you compete with bigger brands.,https://example.com/how-to-start-a-shopify-store-using-ai-beginners-guide-for-2026
Stop guessing: find the best start a Shopify store using AI,"This guide covers everything you need to know about start a Shopify store using AI — including what to avoid, what to prioritise, and how to get started on a budget.",https://example.com/how-to-start-a-shopify-store-using-ai-beginners-guide-for-2026
The only guide you need for start a Shopify store using AI,"Ecommerce beginners: here's your shortcut to start a Shopify store using AI. We cover the tools, the steps, and the tips that actually make a difference in 2026.",https://example.com/how-to-start-a-shopify-store-using-ai-beginners-guide-for-2026
Smart tools for smart ecommerce: start a Shopify store using AI,"Want to work smarter, not harder? Start a shopify store using ai is one of the fastest ways to level up your Shopify store without hiring a team. See how inside.",https://example.com/how-to-start-a-shopify-store-using-ai-beginners-guide-for-2026
Ecommerce on autopilot — start a Shopify store using AI,"From product research to customer support, AI is reshaping ecommerce for beginners. This post on start a Shopify store using AI is your starting point. Save it for later!",https://example.com/how-to-start-a-shopify-store-using-ai-beginners-guide-for-2026
Start smarter: start a Shopify store using AI,"Smart AI Growth Hub breaks down start a Shopify store using AI for ecommerce beginners — with honest reviews, real pricing, and actionable next steps. No fluff.",https://example.com/how-to-start-a-shopify-store-using-ai-beginners-guide-for-2026
